Date,Media Sources,Neutral,Positive,Text,Tweet Polarity,Tweets Order
12/14/2019,CNN,1.0,0.0,tyler perry opened tyler perry studios complete 12 sound stages made history first studio ful https tco mksehzpd6,0.0,-70
12/14/2019,CNN,0.816,0.0,ice detained high school sophomore school leaped action https tco 95gohq9qb0 https tco j8fyzrmdp,-0.4019,-71
12/14/2019,CNN,1.0,0.0,tokyos haneda airpofifthbusiest airpoworld delivered 85 flights https tco ndetkft31e,0.0,-72
12/14/2019,CNN,1.0,0.0,giant 3d printer used build two houses impoverished rural pameico last week marking sta https tco tgntwiusiw,0.0,-73
12/14/2019,CNN,0.708,0.132,team salmon farmers rescued bald eagle trapped octopus grasp canadas vancouver island https tco i0zyzf9vei,-0.1531,-74
12/14/2019,CNN,1.0,0.0,time magazine chosen greta thunberg person year 16yearold swedish climate activist known https tco fzctcwfbej,0.0,-75
12/14/2019,CNN,0.879,0.121,telescope made 64 satellite dishes helping south africa make discoveries space https tco jps4t6naq8,0.296,-76
12/14/2019,CNN,1.0,0.0,past seven years greg osterland decorated ohio home 25 000 lights goal real life vers https tco tsarudmprw,0.0,-77
12/14/2019,CNN,0.661,0.207,someone gained access familys ring security camera used speaker feature harass 8yearold da https tco v4zrtf532,0.2023,-78
12/14/2019,CNN,1.0,0.0,egypt unveiled unprecedented discovery dozens mummified sacred animals including cats crocodiles two https tco wbwdinsqjs,0.0,-79
12/14/2019,CNN,0.863,0.137,hungry man ate 120 000 banana ainstallation says isnt sorry create ahttps tco u8shjogi8h,0.323,-80
12/14/2019,CNN,0.711,0.0,ruquan brown 17 high school football captain advocate gun violence washington dc landed https tco pu7uui55hs,-0.7579,-81
12/14/2019,CNN,1.0,0.0,california church displaying nativity scene depicting jesus mary joseph refugees cages draw https tco 2r7showrzq,0.0,-82
12/14/2019,CNN,1.0,0.0,presidents kings given leeway congress forgoes duty oversee eecutive branch https tco mywqyiujz,0.0,-83
12/14/2019,CNN,1.0,0.0,olivia newtonjohns iconic black leather jacket movie grease sold 243 200 last month pro https tco sdbylzag,0.0,-84
12/14/2019,CNN,0.893,0.107,watch mini cheetah robots backflips play soccer mit fourlegged robots powered 12 motor https tco pmaiuyoapv,0.34,-85
12/14/2019,CNN,1.0,0.0,north korea says conducted another crucial test countrys sohae satellite launching ground https tco rv6sygayv,0.0,-86
12/14/2019,CNN,1.0,0.0,cave adepicting hunting scene found indonesia dated 44 000 years old making oldest rock https tco zmitsbyezd,0.0,-87
12/14/2019,CNN,0.667,0.0,brazils president called swedish climate change activist greta thunberg brat condemned violence agai https tco cnaf6njlz,-0.7906,-88
12/14/2019,CNN,0.708,0.132,team salmon farmers rescued bald eagle trapped octopus grasp canadas vancouver island https tco itzcqkc4kj,-0.1531,-89
12/14/2019,CNN,0.878,0.122,nikes new swimwear line include fullcoverage swimsuit hijab tunic top leggings https tco tpor40hdds,0.2023,-90
12/14/2019,CNN,1.0,0.0,ancient egyptian apeople often seen sporting cones heads first time archaeolo https tco gclo2gbvai,0.0,-91
12/14/2019,CNN,0.734,0.193,internet falling love physics professor tidewater community college virginia beach virginia https tco twkz3za8m,0.5574,-92
12/14/2019,CNN,0.754,0.246,sweet watch amazon delivery driver happy dance homeowner left snacks ni https tco 7gdlrb3ko6,0.7066,-93
12/14/2019,CNN,1.0,0.0,former president clintons impeachment late 90s democratic republican lawmakers made completely https tco abijmznf,0.0,-94
12/14/2019,CNN,0.49,0.281,active ingredient magic mushrooms could safely used treat depression drugs failed https tco knz4zjtmtl,0.1531,-95
12/14/2019,CNN,0.85,0.15,samlor korkor traditional soup khmer noodles 30 favorite cambodian dishes https tco g0nqd2jgza,0.4588,-96
12/14/2019,CNN,0.766,0.234,instinct kicked grabbed leash security camera footage shows moment man saved neig https tco cj9a2b9de,0.6369,-97
12/14/2019,CNN,1.0,0.0,two police officers philadelphia using karaoke break barriers connect people commu https tco few7jtujot,0.0,-98
12/14/2019,CNN,0.875,0.0,need get chest says brookebcnn trump attacking greta thunberg twitterit go wi https tco pd0khflzhm,-0.4588,-99
11/08/2018,Fox News,1.0,0.0,breaking federal appeals courules trump administration daca https tco khnrnvekam,0.0,100
11/08/2018,Fox News,0.615,0.115,breaking news grand jury indicts captain missouri duck boat sank severe weather killing 17 people https tco ffoogzrwdo,-0.6124,99
11/08/2018,Fox News,0.638,0.0,police identify gunman opened fire inside california bar killing 12 https tco pvityr54a,-0.7783,98
11/08/2018,Fox News,0.611,0.389,supreme coujustice ruth bader ginsburg fractures 3 ribs fall https tco 9um9hktz4m,0.7906,97
11/08/2018,Fox News,0.833,0.0,sgt ron helus fatally shot responded mass shooting nov 7 bar thousand oaks califor https tco voh3owpn5s,-0.6369,96
11/08/2018,Fox News,0.672,0.0,tom homan tragedy every time https tco dmv68hfdz0 https tco hrq51vjg7,-0.6597,95
11/08/2018,Fox News,0.862,0.0,people walk away scene thousand oaks calif gunman opened fire wednesday https tco o3oo2ill8o,-0.34,94
11/08/2018,Fox News,1.0,0.0,teylor whittler describes witnessed california bar shooting https tco dmv68hfdz0 https tco yzntzgqoyy,0.0,93
11/08/2018,Fox News,1.0,0.0,fbi agent talks potential witness stand near scene thousand oaks calif gunman open https tco 7qomntym0,0.0,92
11/08/2018,Fox News,0.87,0.0,ventura county fire department captain stan ziegler hundreds first responders responded initially scene https tco o4garhmy4e,-0.34,91
11/08/2018,Fox News,0.795,0.105,people comfostand near scene thousand oaks calif gunman opened fire https tco wpi4spirc,0.0258,90
11/08/2018,Fox News,0.736,0.0,california bar shooting leaves 12 dead including sheriffs sergeant police say https tco dmv68hfdz0 https tco wvjarppwpv,-0.6486,89
11/08/2018,Fox News,0.719,0.0,california bar shooting leaves 12 dead including sheriffs sergeant police say https tco gqi77wmuyz,-0.6486,88
11/08/2018,Fox News,1.0,0.0,sheriffs deputies speak potential witnesses stand near scene thousand oaks calif gunm https tco jpe8k9oqhr,0.0,87
11/08/2018,Fox News,0.677,0.0,13 dead country music bar including gunman https tco pvityr54a https tco uurbiatqte,-0.6486,86
11/08/2018,Fox News,0.719,0.0,12 dead shooting thousand oaks nightclub police say https tco pvityr54a https tco o8nf8wujcz,-0.6486,85
11/08/2018,Fox News,0.765,0.0,breaking news least 12 dead shooting thousand oaks nightclub police say https tco u6svdzhq5,-0.6486,84
11/08/2018,Fox News,1.0,0.0,carleyshimkus live fo news update facebook watch https tco hnrb8zeph https tco cq9ukjuik,0.0,83
11/08/2018,Fox News,1.0,0.0,authorities deliver update shooting thousand oaks california courtesy kabc https tco btgifn5,0.0,82
11/08/2018,Fox News,1.0,0.0,pastor dimas salaberrios california shooting immediate thoughts go families whats happ https tco iowf5vol2l,0.0,81
11/08/2018,Fox News,0.78,0.22,las vegas shooting survivors inside thousand oaks bar friends say https tco nw9tlton9n,0.4767,80
11/08/2018,Fox News,0.765,0.0,update least 11 wounded shooting california bar gunman dead police say https tco awrowfbery,-0.6486,79
11/08/2018,Fox News,0.619,0.0,authorities confirm gunman dead fofriendsfirst https tco pvityr54a https tco a2eih1ewma,-0.6486,78
11/08/2018,Fox News,0.892,0.0,ventura county sheriffs office captain garo kuredjian dont know condition victims https tco 96mt27whzv,-0.3182,77
11/08/2018,Fox News,1.0,0.0,least 11 shot including sheriffs deputy jonathan hunt latest scene california shooti https tco slzlymsrn5,0.0,76
11/08/2018,Fox News,0.714,0.0,witnesses describe chaotic scene thousand oaks shooting https tco qe8rqkgjz3,-0.4939,75
11/08/2018,Fox News,0.764,0.0,update least 11 people hucalifornia shooting fofriendsfirst https tco pvityr54a https tco rgwikaf4f,-0.5267,74
11/08/2018,Fox News,0.881,0.119,daniel hoffman california shooting still active shooter scene focus dealing https tco piwhhe5hu,0.4019,73
11/08/2018,Fox News,0.856,0.144,former las vegas metro police lt randy sutton respond show incredible bravery ar https tco idcjjuvrmp,0.4939,72
11/08/2018,Fox News,1.0,0.0,authorities deliver briefing shooting thousand oaks california courtesy kcbs https tco 5vgzz3rdil,0.0,71
11/08/2018,Fox News,1.0,0.0,mass shooting california bar heatherchilders amp jackieibanezfnc latest fofriendsfirst https tco 8c8h5lufcu,0.0,70
11/08/2018,Fox News,1.0,0.0,tesla names robyn denholm chairman replace elon musk via fobusiness https tco skjbudod,0.0,69
11/08/2018,Fox News,0.783,0.126,marcthiessen president today made clear wants cut deals democrats quite frankl https tco 3ea2dn4vqh,0.2006,68
11/08/2018,Fox News,0.782,0.0,tuckercarlson everyone else obsessed dossiers fisa warrants sessions worried mission https tco lsvnoqzmsq,-0.4404,67
11/08/2018,Fox News,0.44,0.216,wifes dying wish clean bloody crime scene suspect claims reports https tco 7wd39jdeb,-0.4939,66
11/08/2018,Fox News,1.0,0.0,developing massive police response reports shooting california nightclub https tco awrowfspj6,0.0,65
11/08/2018,Fox News,0.842,0.158,senatemajldr mitch mcconnell said wednesday democrats republicans address health care https tco mktkmz7f,0.4939,64
11/08/2018,Fox News,0.845,0.155,joseph digenova could replace ag sessions chrischristie would full confidence potus https tco lt485btkg,0.5106,63
11/08/2018,Fox News,0.69,0.186,dem gavinnewsoms wild victory party la features controversial rapper common https tco v9sspouh7,0.2263,62
11/08/2018,Fox News,0.704,0.296,jasoninthehouse attorney general jeffsessions patriot good republican applaud hi https tco mria8l8dom,0.7096,61
11/08/2018,Fox News,0.793,0.207,devotees lit earthen lamps ayodhya india padiwali celebrations also known festival lights https tco uwgznrkvqd,0.5719,60
11/08/2018,Fox News,0.721,0.0,tgowdysc jeff sessions resigning going happenhes proverbial dead man walking severa https tco ojkl4kmftz,-0.7351,59
11/08/2018,Fox News,0.714,0.0,mob chants threats outside tuckercarlsons dc home https tco ije8m5gjwi,-0.4215,58
11/08/2018,Fox News,0.717,0.283,tuckercarlson supporting marriage children best maybe way republicans us https tco fqpwc8tay,0.7964,57
11/08/2018,Fox News,0.707,0.293,kennedynation dems 2020 better without nancy https tco 54vtciffg4,0.4404,56
11/08/2018,Fox News,0.693,0.0,battlegroundstate dems opposed kavanaugh defeated https tco guqmsvjd74,-0.4767,55
11/08/2018,Fox News,0.939,0.061,jim_jordan run house gop leader match potuss intensity thats want https tco 2vow1ykcsi,0.0772,54
11/08/2018,Fox News,1.0,0.0,senatemajldr dem votes kavanaugh godsend gop midterms https tco ietr8sp4eq,0.0,53
11/08/2018,Fox News,1.0,0.0,marcthiessen theres lots things democrats could take stand find inherently unacceptable https tco c7ufdzfd60,0.0,52
11/08/2018,Fox News,0.829,0.0,darrellissa mueller probe two years long time look crime cant prove https tco pl9kpsy,-0.5423,51
11/08/2018,Fox News,1.0,0.0,second teen dies gunshot wound oklahoma moms rampage authorities say https tco vuqsa3mq3,0.0,50
11/08/2018,Fox News,0.783,0.126,marcthiessen president today made clear wants cut deals democrats quite frank https tco mgvdjqvfut,0.2006,49
11/08/2018,Fox News,0.833,0.0,florida highway patrol cruiser hits 142 mph pursuit catches fire https tco gqwki45aam,-0.34,48
11/08/2018,Fox News,1.0,0.0,democratic strategist lesliemarshall need wall wall cant afford comp https tco tzrwvjqevv,0.0,47
11/08/2018,Fox News,0.783,0.0,se offender gets 22 years missing boy 14 found room halfway house authorities say https tco sdd0vqzob4,-0.5719,46
11/08/2018,Fox News,0.72,0.192,potus touts senate gains lelandvittebreaks results fonewsnight https tco vmzif8sghh,0.3182,45
11/08/2018,Fox News,1.0,0.0,former kavanaugh colleague among group considered replace sessions ag reports https tco haldz2mg,0.0,44
11/08/2018,Fox News,1.0,0.0,close call meticulous vote count transpiring arizona senate race aacuna1 reports fonewsnight https tco dv6e4oge,0.0,43
11/08/2018,Fox News,0.603,0.298,former seal mocked snl wins house seat calls vets congress https tco t0pahopphh https tco qhs5bvoe2u,0.6841,42
11/08/2018,Fox News,1.0,0.0,south carolina voter told remove trump shiorder vote repohttps tco wy2edspdf,0.0,41
11/08/2018,Fox News,1.0,0.0,potus hopefully work together net year continue delivering american people https tco fdlczqzn4g,0.0,40
11/08/2018,Fox News,1.0,0.0,former us attorney harry litman whitaker amp mueller probe think people think unlikely would https tco 6w1ehbz7zz,0.0,39
11/08/2018,Fox News,0.896,0.104,pete davidsons snl castmate kenan thompson talks dan crenshaw joke figuring way right w https tco mlijf907fk,0.296,38
11/08/2018,Fox News,0.704,0.296,jasoninthehouse attorney general jeffsessions patriot good republican applaud hi https tco lqmoqmhcjz,0.7096,37
11/08/2018,Fox News,1.0,0.0,tom dupree acting attorney general matthew whitaker calls recuse russia think meritles https tco 74tweqngjg,0.0,36
11/08/2018,Fox News,0.873,0.0,cabinet shakeup epected jeffsessions pushed edhenry reports fonewsnight https tco 6utwycpzrv https tco my7kh6s4t7,-0.1531,35
11/08/2018,Fox News,0.845,0.0,new reactions sessions resignation catherine herridge story fonewsnight https tco 6utwychbgv https tco faiatymsgc,-0.296,34
11/08/2018,Fox News,0.775,0.0,mlb star bharper3407 rejects 300m offer nationals reports via fobusiness https tco bgfoyi7fnh,-0.4939,33
11/08/2018,Fox News,0.735,0.0,doug schoen trump shouldnt fired jeff sessions heres https tco 0ittpzyqy,-0.5574,32
11/08/2018,Fox News,0.845,0.155,joseph digenova could replace ag sessions chrischristie would full confidence potus https tco 3eoyiurd3,0.5106,31
11/08/2018,Fox News,1.0,0.0,brady bunch cast take patv homes renovation repohttps tco rebtv4qkql,0.0,30
11/08/2018,Fox News,0.804,0.0,tuckercarlson dems election message trump substance https tco cscvhqkfa,-0.296,29
11/08/2018,Fox News,0.878,0.0,11yearold north carolina charged putting needles halloween candy police say https tco dm3f07wpit,-0.2023,28
11/08/2018,Fox News,0.798,0.202,rhino rescue scientists may hold key saving northern white rhinoceros etinction https tco vuifttcbtk,0.5106,27
11/08/2018,Fox News,1.0,0.0,fobusiness rick scott socialism happen nation going happen watch https tco clnounngno,0.0,26
11/08/2018,Fox News,1.0,0.0,democrat colin allred unseated rep pete sessions wont say hell back pelosi https tco mno8bkgia,0.0,25
11/08/2018,Fox News,1.0,0.0,surveillance video shows michigan woman reportedly reversing car store https tco tjr2cusz8a,0.0,24
11/08/2018,Fox News,0.842,0.158,senatemajldr mitch mcconnell said wednesday democrats republicans address health care https tco f54behvoa,0.4939,23
11/08/2018,Fox News,0.638,0.17,woman finds diamond proposal ring shames https tco uolhuhebd,-0.0772,22
11/08/2018,Fox News,0.743,0.0,mcdonalds customers 5m lawsuit unwanted quarter pounder cheese dismissed judge https tco ybevl4cafk,-0.4215,21
11/08/2018,Fox News,1.0,0.0,trump neuters obamacare birth control coverage mandate limits plans covering abortion https tco z1udaql,0.0,20
11/08/2018,Fox News,0.856,0.144,new york police department gathered 20 saluting officers held aviation flyover honor emergen https tco auns1mblzm,0.4939,19
11/08/2018,Fox News,0.894,0.106,fobusiness kellyannepolls many people want work potus administration https tco to6mczfka7,0.0772,18
11/08/2018,Fox News,0.776,0.224,trooper took beautiful photo double rainbow new york state police squad car tuesday https tco j9v1h3ja5p,0.6833,17
11/08/2018,Fox News,1.0,0.0,jeff sessions departure leads questions russia probes future https tco 5iwsdcmryo,0.0,16
11/08/2018,Fox News,0.782,0.0,tuckercarlson everyone else obsessed dossiers fisa warrants sessions worried mission https tco 9kv1dtfgkv,-0.4404,15
11/08/2018,Fox News,1.0,0.0,south carolina voter told remove trump shiorder vote repohttps tco hokjgwyv,0.0,14
11/08/2018,Fox News,0.909,0.091,virginia drugdealing mom gets 10day jail sentence providing marijuana three children https tco piu3cthv,0.0772,13
11/08/2018,Fox News,0.717,0.283,tuckercarlson supporting marriage children best maybe way republicans us https tco wreln434wb,0.7964,12
11/08/2018,Fox News,0.837,0.163,fo news channel tops broadcast cable news networks total viewers midterm election coverage https tco h418qsswpi,0.5106,11
11/08/2018,Fox News,0.809,0.191,sacha baron cohen revives borat character talk politics midterm election https tco taa4z5rcj1,0.3818,10
11/08/2018,Fox News,0.686,0.0,violinist claims southwest airlines forced leave flight refused check 80 000 instrument https tco s5tsoh3uu,-0.6597,9
11/08/2018,Fox News,0.915,0.0,take word jim jordan warns congressional investigations nadler waters schiff https tco zsupobdbg,-0.1027,8
11/08/2018,Fox News,1.0,0.0,former governor john sununu really made big difference house races around country last night https tco hyftii57mo,0.0,7
11/08/2018,Fox News,0.826,0.0,georgia posts private information 300 000 absentee voters via keiperjourno https tco 5h4etzthyc,-0.2732,6
11/08/2018,Fox News,0.795,0.0,cnns jim acosta press pass suspended white house sarah sanders announces https tco 5iiwrurci,-0.4767,5
11/08/2018,Fox News,0.807,0.0,breaking cnns jim acosta press pass suspended white house sarah sanders announces https tco ebitlnvfuj,-0.4767,4
11/08/2018,Fox News,1.0,0.0,govchrissununu dont think last night referendum president think last night really refe https tco lsznjepqk,0.0,3
11/08/2018,Fox News,0.825,0.098,dershowitz sessions departure gop senators allow trump demand loyalty new ag https tco lrq24ih7lc,0.1027,2
11/08/2018,Fox News,1.0,0.0,mikeemanuelfo democrats gear 2020 presidential race #specialrepotonight https tco 2rynfdshio,0.0,1
11/08/2018,Fox News,0.939,0.061,jim_jordan run house gop leader match potuss intensity thats want https tco pdtb3oqcw6,0.0772,0
11/08/2018,Fox News,0.891,0.0,jim_jordan jeff sessions resignation think appropriate action taken today potus https tco olg8piw6dr,-0.296,-1
11/08/2018,Fox News,0.859,0.0,attorney general jeff sessions resigns wake midterm elections edhenry reports #thestory https tco 2fttaq0ldf,-0.3182,-2
11/08/2018,Fox News,0.683,0.317,maraliasson #midterms2018 overall think democrats great night win house back https tco gbot3jc7tj,0.836,-3
11/07/2018,Fox News,0.794,0.0,marcthiessen sessions resigning potus request president learning mistakes https tco glqosvwa71,-0.5267,-4
11/07/2018,Fox News,1.0,0.0,staff sgt kyle snodgrass meets son griffin first time macdill air force base florida tuesday https tco sjf7hg05h,0.0,-5
11/07/2018,Fox News,0.878,0.0,california man charged attempted kidnapping hopping bus full schoolchildren https tco ig6hozft3s,-0.2023,-6
11/07/2018,Fox News,1.0,0.0,jeff sessions departure leads questions russia probes future https tco qducuo5fl,0.0,-7
11/07/2018,Fox News,1.0,0.0,tgowdysc muller probe dont think anything going happen rod rosenstein mueller https tco lknz4bgsje,0.0,-8
11/07/2018,Fox News,0.721,0.0,tgowdysc jeff sessions resigning going happenhes proverbial dead man walking severa https tco 99nfr9bj8i,-0.7351,-9
11/07/2018,Fox News,0.578,0.168,suspect trump walk fame vandalism pleaded contest officials say https tco utqbfj28ev,-0.128,-10
11/07/2018,Fox News,0.663,0.205,justice department needs stability starr says hes concerned following sessions resignation https tco ks0ymujs0l,0.296,-11
11/07/2018,Fox News,1.0,0.0,postelection day press conference wednesday house minority leader nancypelosi said house democrats w https tco fw7obtogmr,0.0,-12
11/07/2018,Fox News,0.748,0.159,former attorney general jeff sessions departs justice department hours resigned president trumps r https tco 6rhskwl84,0.34,-13
11/07/2018,Fox News,1.0,0.0,maine waters continuing trump finance probe deal https tco f0d27wzm2k,0.0,-14
11/07/2018,Fox News,0.88,0.0,american flag mural pizza shop vandalized protested small town https tco cacnfltguf,-0.128,-15
11/07/2018,Fox News,1.0,0.0,fobusiness florida sports gambling measure passes despite nfls dolphins plea voters https tco gvrop7efoj,0.0,-16
11/07/2018,Fox News,1.0,0.0,democratic presidential hopefuls already jockeying 2020 https tco naw7yseunb,0.0,-17
11/07/2018,Fox News,0.667,0.333,mark penn trump needs unifier succeed move successful reelection https tco tqjl4qfob8,0.7906,-18
11/07/2018,Fox News,0.837,0.0,darrellissa mueller probe two years long time look crime cant prove teamcavuto https tco b9seawiby0,-0.5423,-19
11/07/2018,Fox News,0.585,0.0,funerals scheduled 3 wisconsin girl scouts mother killed hitandrun https tco d1khaaptu8,-0.7964,-20
11/07/2018,Fox News,1.0,0.0,mcconnell dem votes kavanaugh godsend gop midterms https tco hei7clsogm,0.0,-21
11/07/2018,Fox News,1.0,0.0,shepnewsteam live fo news update facebook watch https tco hnrb8zeph https tco lgypg0szaz,0.0,-22
11/07/2018,Fox News,1.0,0.0,fonewsresearch trumps biggest beefs w jeff sessionsrussia probe recusal investigating ds probing clinton ties ru,0.0,-23
11/07/2018,Fox News,0.673,0.0,fonewsresearch trumps recent attacks sessions8 11 scared stiff mia8 23 never took control doj8 25 doesnt understand w,-0.8286,-24
11/07/2018,Fox News,1.0,0.0,president realdonaldtrump tweeted earlier today matthew whitaker serving chief staff https tco 7ranms7myy,0.0,-25
11/07/2018,Fox News,0.766,0.124,protect rule law repadamschiff tweets statement jeff sessions resigns attorney gener https tco ajc6owflzq,0.0772,-26
11/07/2018,Fox News,1.0,0.0,deputy ag rosenstein heading whitehouse previously scheduled 4 pm meeting https tco sfa26v0ock https tco tryj2l876e,0.0,-27
11/07/2018,Fox News,0.82,0.0,senator markwarner jeff sessions resignation attorney general https tco sfa26v0ock https tco rhsfpaojr,-0.296,-28
11/07/2018,Fox News,1.0,0.0,catherine herridge reports acting attorney general matthew whitaker shepnewsteam https tco sfa26v0ock https tco h9ktj0p2hs,0.0,-29
11/07/2018,Fox News,1.0,0.0,senschumer calls acting ag whitaker recuse mueller investigation https tco sfa26v0ock https tco tvhvnhzet,0.0,-30
11/07/2018,Fox News,1.0,0.0,scott walker concedes democrat tony evers wisconsin gubernatorial race https tco cnyiubmq9q,0.0,-31
11/07/2018,Fox News,1.0,0.0,acting ag whitaker sworn https tco sfa26v0ock https tco lrztd6d6n2,0.0,-32
11/07/2018,Fox News,0.804,0.0,senatemajldr releases statement following ag jeff sessions resignation https tco sfa26v0ock https tco e8bpukvmhn,-0.296,-33
11/07/2018,Fox News,0.855,0.0,timeline events leading jeff sessions resignation attorney general shepnewsteam https tco ct61blqafm,-0.296,-34
11/07/2018,Fox News,0.891,0.0,know potus morning asked resignation jeff sessions johnrobertsfo reports li https tco vndgmby6zb,-0.296,-35
11/07/2018,Fox News,0.761,0.0,read attorney general jeff sessions resignation letter https tco trpklqjp2r,-0.296,-36
11/07/2018,Fox News,1.0,0.0,former #trump administration officials list notable departures https tco af7oe87ifa,0.0,-37
11/07/2018,Fox News,0.76,0.24,chrisstirewalt sessions fearless relentless many ways prosecutor presidents agenda https tco yomuyofwqs,0.4767,-38
11/07/2018,Fox News,1.0,0.0,request submitting resignationwatch catherine herridge reads attorney general jeff sessions https tco uwvnalamwy,0.0,-39
11/07/2018,Fox News,0.874,0.0,breaking news attorney general jeff sessions resigns chief staff matthew g whitaker becomes acting ag https tco sfa26v0ock,-0.3182,-40
11/07/2018,Fox News,0.874,0.0,breaking news attorney general jeff sessions resigns chief staff matthew g whitaker becomes acting ag https tco qs2wgqf2we,-0.3182,-41
11/07/2018,Fox News,0.631,0.177,opinion yes democrats house behind pelosis soaring rhetoric harsh political reality https tco zpofoyqs5,-0.3319,-42
11/07/2018,Fox News,1.0,0.0,senschumer holds press conference discuss results 2018 midterm elections https tco bmol8ocn8h,0.0,-43
11/07/2018,Fox News,1.0,0.0,least 77 military veterans elected congress #midterms2018 https tco ungswzmg,0.0,-44
11/07/2018,Fox News,0.429,0.0,nypd salutes k9 loses battle cancer https tco ug0w9vaj0h,-0.8519,-45
11/07/2018,Fox News,1.0,0.0,senatemajldr think voting kavanaugh mistake dailybriefing https tco zgqp1nfa,0.0,-46
11/07/2018,Fox News,1.0,0.0,senatemajldr democrats paresponsibility governing lets get together figure h https tco p4ebs4kmoz,0.0,-47
11/07/2018,Fox News,0.757,0.243,senatemajldr work together need improve health care system american w https tco byy0wdf5fd,0.7269,-48
11/07/2018,Fox News,0.933,0.067,marshablackburn individuals want see washington dc work way going lead us government https tco dvfrlsslop,0.0772,-49
11/07/2018,Fox News,1.0,0.0,nancypelosi work together potus https tco ldbmgcca5,0.0,-50
11/07/2018,Fox News,1.0,0.0,nancypelosi believe responsibility seek common ground cannot mu https tco bnhcwog3qa,0.0,-51
11/07/2018,Fox News,0.734,0.266,nancypelosi yesterdays election vote protect americas health care vote restore https tco uepnjqt2c,0.7003,-52
11/07/2018,Fox News,0.64,0.36,ivankatrump shared message #midterms2018 tweeting real winner america https tco efqarzg5f,0.7351,-53
11/07/2018,Fox News,1.0,0.0,nancypelosi women led way victory least 30 new women coming congress #midterms2018 https tco gpz1gqz6fy,0.0,-54
11/07/2018,Fox News,0.696,0.304,nancypelosi biggest winner yesterday health care american people seniors hardwork https tco f8p1fumbk,0.7906,-55
11/07/2018,Fox News,1.0,0.0,today danaperino talks senatemajldr #midterms2018 president realdonaldtrumps postelection day pr https tco vln1wjknv2,0.0,-56
11/07/2018,Fox News,1.0,0.0,house democratic leader nancypelosi holds news conference midterms https tco jutussbj8j,0.0,-57
11/07/2018,Fox News,0.824,0.0,jon tester projected defeat matt rosendale montana senate race https tco cmbrsngfzc https tco 6uajbcqoqd,-0.4588,-58
11/07/2018,Fox News,0.632,0.368,potus would like see bipartisanship id like see unity think good chance seeing https tco lqvr5vdour,0.8581,-59
