Date,Media Sources,Neutral,Positive,Text,Tweet Polarity,Tweets Order
12/15/2019,BBC News (UK),1.0,0.0,bbcspobbc sports personality coach year 2019 john blackie https tco g41wwvyta #spoty https tco gmpc,0.0,100
12/15/2019,BBC News (UK),0.759,0.241,bbcspowinner bbc sports personality lifetime achievement award baroness tanni greythompson https tco g4,0.8074,99
12/15/2019,BBC News (UK),0.678,0.227,bbcspoyears helen rollason award goes man shown immense bravery incredible heaadversity,0.5994,98
12/15/2019,BBC News (UK),0.906,0.0,bbcspobbc sports personality world spostar year 2019 eliud kipchoge moment broke twohou,-0.4215,97
12/15/2019,BBC News (UK),0.574,0.426,bbcspowinner bbc sports personality unsung hero award goes keiren thompson nottingham whos inspired many ch,0.9337,96
12/15/2019,BBC News (UK),1.0,0.0,bbcspofive minutes gothis follow #spoty across bbc bbcone bbciplayer bbcspowebsite bbcspor,0.0,95
12/15/2019,BBC News (UK),0.807,0.0,british man shot dead robbery outside hotel buenos aires named 50yearold matthew gibbard northampto https tco lme2k6ahu,-0.6486,94
12/15/2019,BBC News (UK),0.758,0.242,prince louis earliest words inspired tv cook mary berry https tco zukbqhy7yo,0.4939,93
12/15/2019,BBC News (UK),1.0,0.0,bbcweather bbcwthrwatchers spotted large hailstones today including #powys 22mm spot ev,0.0,92
12/15/2019,BBC News (UK),0.856,0.0,bbcspotyson fury split trainer ben davison two years togetherthe announcement comes two months,-0.5719,91
12/15/2019,BBC News (UK),0.777,0.0,faulty valve leaves thousands without water bedfordshire https tco 5ms1vdln,-0.3182,90
12/15/2019,BBC News (UK),0.901,0.0,bbcworld guymon way becoming ghost town opening food processing plantmany meican immigrants arrived,-0.3182,89
12/15/2019,BBC News (UK),1.0,0.0,strictly come dancing final draws 113 million viewers https tco rvtp9hijl,0.0,88
12/15/2019,BBC News (UK),0.804,0.0,sundays headliner spot longer blank space https tco dwuvobk7e8,-0.296,87
12/15/2019,BBC News (UK),0.65,0.35,thank amazing eperience lifethe winners strictly come dancing announced https tco lch9floplr,0.8655,86
12/15/2019,BBC News (UK),1.0,0.0,bbcworld moment bushfire spread across tree canopy australia phenomenon called crowning tap epand https,0.0,85
12/15/2019,BBC News (UK),0.634,0.194,bbcpolitics disastershadow chancellor john mcdonnell apologises wonderful labour mps l,-0.0964,84
12/15/2019,BBC News (UK),1.0,0.0,bbcspochinas state broadcaster reportedly pulled coverage arsenals premier league game man cityit follows comments,0.0,83
12/15/2019,BBC News (UK),1.0,0.0,ministers reviewing licence fee evasion sanction https tco yqngbmh,0.0,82
12/15/2019,BBC News (UK),1.0,0.0,bbcpolitics cannot hold scotland union scotlands first minister nicola sturgeon says snps succes,0.0,81
12/15/2019,BBC News (UK),0.743,0.257,starcinspired australia claim 296run win new zealand first test https tco oge6ooouq,0.5859,80
12/15/2019,BBC News (UK),0.559,0.0,bbcworld botswana cancels hunters licences killing elephant https tco ae8uruk9ta,-0.743,79
12/15/2019,BBC News (UK),0.809,0.0,bbcpolitics general election 2019 let labour leadership battle commence https tco 2cusmq8v5b,-0.3818,78
12/15/2019,BBC News (UK),1.0,0.0,stormzy says hes tried communicate maya ahttps tco l8oliblab,0.0,77
12/15/2019,BBC News (UK),0.717,0.283,bbcpolitics john mcdonnell labour leadership race rebecca long bailey ecellent could brilliant leader#mar,0.8176,76
12/15/2019,BBC News (UK),0.857,0.0,bbcpolitics shadow chancellor john mcdonnell discusses labours defeat #marrthe establishment owns media country,-0.4588,75
12/15/2019,BBC News (UK),0.871,0.0,bbcbreaking far cry science tells us needed lengthy un climate talks end compromise recrimination https,-0.4767,74
12/15/2019,BBC News (UK),1.0,0.0,bbcspochinas state broadcaster reportedly pulled coverage arsenals premier league game man cityit follows comments,0.0,73
12/15/2019,BBC News (UK),1.0,0.0,remember stillborn babies christmas cards https tco cargbassdz,0.0,72
12/15/2019,BBC News (UK),0.766,0.0,bbcworld first time history black women hold titles miss usa miss teen usa miss america miss universe,-0.5267,71
12/15/2019,BBC News (UK),1.0,0.0,bbcworld anna karina french new wave cinema legend dies aged 79 https tco aafcwsyt0a,0.0,70
12/15/2019,BBC News (UK),0.669,0.331,hope theyll found bring little bit joy christmas https tco mey3jhbb7o,0.7533,69
12/15/2019,BBC News (UK),1.0,0.0,bbcpolitics #marr russia repopublishedconservative rishi sunak cant tell eactly p,0.0,68
12/15/2019,BBC News (UK),1.0,0.0,man shot hull street armed police https tco mavqutj13o,0.0,67
12/15/2019,BBC News (UK),0.902,0.0,bbcpolitics general election 2019 john mcdonnell sorry catastrophic election result https tco bnerzkttia,-0.0772,66
12/15/2019,BBC News (UK),0.821,0.0,bbcscotlandnews firefighters tackle major fire glasgow city centre https tco vapcarhcbg https tco uz0fj7roab,-0.34,65
12/15/2019,BBC News (UK),1.0,0.0,bbcpolitics conservative rishi sunak #indyref2 absolutely intention hold one#marr https tco wdakdwa1h htt,0.0,64
12/15/2019,BBC News (UK),1.0,0.0,bbcspoty #spoty klaon gordonramsay message youyou vote bbcspoty 2019 tonights live show b,0.0,63
12/15/2019,BBC News (UK),0.918,0.0,bbcpolitics #marr going stand labours net leaderlisa nandy im seriously thinking ithttps tco zphfpv,-0.1779,62
12/15/2019,BBC News (UK),0.804,0.133,bbcspoaustralia set new zealand mammoth 468 win first test perth attempt going well,0.4563,61
12/15/2019,BBC News (UK),0.801,0.199,bbcpolitics nicola sturgeon scotland cannot imprisoned uk https tco uzjk0vyq,0.357,60
12/15/2019,BBC News (UK),0.7,0.0,bbcworld husband relatives killed 358 people village killedhasina begun says myanmar milita,-0.875,59
12/15/2019,BBC News (UK),0.819,0.078,bbcpolitics anyones blame meshadow chancellor john mcdonnell apologises #marr labours election campaign dis,-0.1531,58
12/15/2019,BBC News (UK),0.875,0.042,bbcpolitics boris johnson thinks saying end matter going find completely utterly wrong,-0.2732,57
12/15/2019,BBC News (UK),1.0,0.0,bbcweather going another windy day many today especially across southern britain gusts 40 55mph also turni,0.0,56
12/15/2019,BBC News (UK),1.0,0.0,bbcworld iran foils second cyberattack week https tco eipyavhnr3,0.0,55
12/15/2019,BBC News (UK),0.696,0.114,bbcnews general election 2019 jeremy corbyn apologises heavy labour defeat https tco iuk5lcrnpq,-0.296,54
12/15/2019,BBC News (UK),0.681,0.0,bbcworld new zealand volcano death toll rises 16 two remain missing https tco id1p64sd4k,-0.7269,53
12/15/2019,BBC News (UK),0.751,0.0,bbcworld british man shot dead robbery outside hotel buenos aires https tco slvgcftnq,-0.6486,52
12/15/2019,BBC News (UK),0.629,0.224,bbcnews samantha morton care system fit purpose https tco 2bll5wasbd,0.2709,51
12/15/2019,BBC News (UK),1.0,0.0,bbcworld uk provide light bulb moment us democrats https tco ziwb2v8ik,0.0,50
12/15/2019,BBC News (UK),0.847,0.153,bbcnews premier league results liverpools lead etended top https tco qc04b8tvf,0.2023,49
12/15/2019,BBC News (UK),1.0,0.0,bbcnews cher lloyd im conveyor belt https tco odtjuid8pg,0.0,48
12/15/2019,BBC News (UK),0.855,0.0,bbcnews avoid election fallout fam christmas https tco ibnwnpio,-0.296,47
12/15/2019,BBC News (UK),0.84,0.0,bbcnews hong kong protests test beijings foreign meddling narrative https tco av6jdo0vl,-0.2263,46
12/15/2019,BBC News (UK),0.769,0.0,bbcnews kitchen gardens combat climate change https tco oz20wa3un,-0.34,45
12/15/2019,BBC News (UK),0.471,0.0,bbcnews post office fiasco decade hell accused https tco hibhh5sdez,-0.8779,44
12/15/2019,BBC News (UK),0.602,0.205,bbcnews jurgen klopp liverpool boss rejects champions league epansion claims https tco ufgfwtvai,0.0516,43
12/15/2019,BBC News (UK),1.0,0.0,bbcnews sports personality year 2019 vote https tco 74bdmhaio,0.0,42
12/15/2019,BBC News (UK),0.87,0.13,bbcworld greta thunberg apologises put leaders wall comment https tco j884bvuj0,0.2023,41
12/15/2019,BBC News (UK),0.913,0.0,bbcworld skiing santas baby pandas twoheaded snake stories may missed week tap epand h,-0.296,40
12/15/2019,BBC News (UK),1.0,0.0,sports personality year vote online https tco gwshc28kgo,0.0,39
12/15/2019,BBC News (UK),0.458,0.0,dagenham stabbing murder arrest man dies https tco nj3phckdbf,-0.7964,38
12/15/2019,BBC News (UK),1.0,0.0,leicester 11 norwich foes fall behind liverpool draw https tco lzj8yilavj,0.0,37
12/15/2019,BBC News (UK),0.652,0.13,general election 2019 jeremy corbyn apologises heavy labour defeat https tco iuk5lcrnpq,-0.296,36
12/15/2019,BBC News (UK),0.643,0.0,new zealand volcano death toll rises 16 two remain missing https tco lrbtj3sy0q,-0.7269,35
12/15/2019,BBC News (UK),0.489,0.0,lebanon crisis dozens hupolice protesters clash beirut https tco gshzkmz4bj,-0.8555,34
12/15/2019,BBC News (UK),0.583,0.0,albania earthquake arrests deaths collapsed buildings https tco kowyr2njzw,-0.6124,33
12/15/2019,BBC News (UK),0.672,0.0,man released partners death wigan hospital https tco vzuodjk5dl,-0.5994,32
12/15/2019,BBC News (UK),0.569,0.26,samantha morton care system fit purpose https tco 2bll5wasbd,0.2709,31
12/15/2019,BBC News (UK),1.0,0.0,saracens 156 munster mark mccall says medics comment jamie george caused brawl https tco jvlzvbwqs,0.0,30
12/15/2019,BBC News (UK),0.816,0.184,premier league results liverpools lead etended top https tco qc04b8tvf,0.2023,29
12/15/2019,BBC News (UK),1.0,0.0,cher lloyd im conveyor belt https tco odtjuid8pg,0.0,28
12/15/2019,BBC News (UK),0.833,0.0,avoid election fallout fam christmas https tco ibnwnpio,-0.296,27
12/15/2019,BBC News (UK),0.808,0.0,hong kong protests test beijings foreign meddling narrative https tco av6jdo0vl,-0.2263,26
12/15/2019,BBC News (UK),0.714,0.0,kitchen gardens combat climate change https tco oz20wa3un,-0.34,25
12/15/2019,BBC News (UK),0.409,0.0,post office fiasco decade hell accused https tco hibhh5sdez,-0.8779,24
12/15/2019,BBC News (UK),0.548,0.233,jurgen klopp liverpool boss rejects champions league epansion claims https tco ufgfwtvai,0.0516,23
12/15/2019,BBC News (UK),1.0,0.0,sports personality year 2019 vote https tco 74bdmhaio,0.0,22
12/15/2019,BBC News (UK),0.435,0.0,ale rodda man charged murder cheshire boys death https tco ci3qoldlj,-0.886,21
12/14/2019,BBC News (UK),0.703,0.297,newspaper headlines boris johnsons whitehall revolution election win https tco dhl8rzface,0.5859,20
12/14/2019,BBC News (UK),0.73,0.27,eliud kipchoge wins world spostar year 2019 https tco gdu5to7qd,0.5719,19
12/14/2019,BBC News (UK),0.693,0.307,strictly come dancing 2019 crowns winners https tco 2ztktadys7,0.4767,18
12/14/2019,BBC News (UK),1.0,0.0,vladimir putin 20 years 20 photos https tco hvq2d8pnyr,0.0,17
12/14/2019,BBC News (UK),0.654,0.0,myanmar rohingya aung san suu kyi cuts haunted figure couhttps tco jiytctoay,-0.6486,16
12/14/2019,BBC News (UK),1.0,0.0,three key economic questions boris johnson https tco q4jwgafubi,0.0,15
12/14/2019,BBC News (UK),0.533,0.0,man 75 arrested partners death wigan hospital https tco zwgc8cymbe,-0.7906,14
12/14/2019,BBC News (UK),0.65,0.0,uk tourist shot dead robbery argentina https tco ibzrrsupem,-0.6486,13
12/14/2019,BBC News (UK),0.65,0.0,ale rodda boy found dead village named https tco khfbs6mgm3,-0.6486,12
12/14/2019,BBC News (UK),0.798,0.0,bbcpolitics theres long history maybe 40 years neglectjohn mcdonnell says wasnt breit caused loss,-0.6486,11
12/14/2019,BBC News (UK),1.0,0.0,bbcpolitics servants nowuk pm boris johnson says conservatives must serve people country visit,0.0,10
12/14/2019,BBC News (UK),0.901,0.0,bbcworld skiing santas twoheaded snake baby pandas stories may missed weekhttps tco jdhv,-0.296,9
12/14/2019,BBC News (UK),1.0,0.0,john lennons sunglasses left back ringo starrs mercedes summer 1968 https tco f4uhg6syaa,0.0,8
12/14/2019,BBC News (UK),1.0,0.0,longleat safari park chipmunks sent hundreds socks https tco aqtct7mkdc,0.0,7
12/14/2019,BBC News (UK),1.0,0.0,bbcworld un climate talks hit rough waters https tco ogmkz1nyqe,0.0,6
12/14/2019,BBC News (UK),0.508,0.0,wigan stabbing two women injured attack https tco 4lhmk62eru,-0.7003,5
12/14/2019,BBC News (UK),0.887,0.0,bbcpolitics general election 2019 labour facing long haul warns mcdonnell https tco u5lornhdby,-0.1027,4
12/14/2019,BBC News (UK),0.796,0.0,young son lost fisherman raises 2 500 rnli https tco 5gywegmaz5,-0.3182,3
12/14/2019,BBC News (UK),1.0,0.0,#ge2019 sturgeon gathers snp mps victory https tco feuk0qimhz,0.0,2
12/14/2019,BBC News (UK),0.652,0.348,switching broadband provider could save 120 https tco j8kujo0ee,0.4939,1
12/14/2019,BBC News (UK),0.753,0.247,bbcpolitics want people north east know repay trustuk pm boris johnson promises get breit done,0.7351,0
12/14/2019,BBC News (UK),0.786,0.0,bbcpolitics election 2019 labour meets consider future defeat https tco tza475nbr3,-0.4588,-1
12/14/2019,BBC News (UK),1.0,0.0,bbcpolitics ive done bit need move onlabours john mcdonnell confirms wont panet shadow cabinet foll,0.0,-2
12/14/2019,BBC News (UK),0.709,0.189,bbcpolitics feel like politics abandoned felt absolute sheer relief young people think election h,0.3818,-3
12/14/2019,BBC News (UK),1.0,0.0,bbcspoalmost time #spoty sundayheres everything need know 2019 event https tco 0iokfz0tz bbcsp,0.0,-4
12/14/2019,BBC News (UK),0.807,0.193,bbcwalesnews little jacobs new prosthetic means hug brother https tco d2182a9cp9 https tco zyokm0hkl,0.4767,-5
12/14/2019,BBC News (UK),0.922,0.0,miss election results night catch happened across uk interactive map https tco 8skaotuwn,-0.1531,-6
12/14/2019,BBC News (UK),0.896,0.0,bbcworld krystal eve browitt first victim new zealand volcano eruption named police https tco r2flmuq0my,-0.2732,-7
12/14/2019,BBC News (UK),0.89,0.0,bbcpolitics key moments #ge2019 conservatives sweeping aside labour heartlands lib dem leader jo swinson losing h,-0.3818,-8
12/14/2019,BBC News (UK),0.777,0.0,bbcspolets get lets make history anthony joshua says fight tyson fury deontay wilder happen net,-0.743,-9
12/14/2019,BBC News (UK),0.891,0.109,interested know whats changed election look analysis put postcode look hi https tco ricabn3qs,0.4019,-10
12/14/2019,BBC News (UK),1.0,0.0,250kg leatherback turtle found near esse river https tco ebtlb3dhtc,0.0,-11
12/14/2019,BBC News (UK),0.442,0.558,bless merry christmas https tco wfd1hmbn4u,0.743,-12
12/14/2019,BBC News (UK),0.862,0.0,bbcpolitics general election 2019 animated tour 10 stops https tco tci8dtnkv,-0.1531,-13
12/14/2019,BBC News (UK),0.833,0.167,bbcpolitics prime minister taoiseach aim restore ni eecutive https tco b1rompcup,0.296,-14
12/14/2019,BBC News (UK),1.0,0.0,emmerdale actress sheila mercier dies aged 100 https tco 4nqva1gvuq,0.0,-15
12/14/2019,BBC News (UK),0.525,0.383,bbcworld wear success like tshilike tuedobollywood star shah rukh khan talks success failures two l,0.8555,-16
12/14/2019,BBC News (UK),1.0,0.0,bbcpolitics young people think election heres 100 voice notes #ge2019 #thenetepisode teamfilm https,0.0,-17
12/14/2019,BBC News (UK),0.577,0.218,bbcspothreetime champion michael van gerwen suffered scare opening night pdc world championship ally pallyhe,0.1027,-18
12/14/2019,BBC News (UK),1.0,0.0,whos going take home strictly trophy tap epand https tco bcszlyvlcc https tco bmfua8ywf,0.0,-19
12/14/2019,BBC News (UK),0.844,0.156,bbcpolitics general election 2019 pm visit north labour heartland gains https tco cbn0ikrbtl,0.34,-20
12/14/2019,BBC News (UK),0.874,0.0,finnish minister sorry instagram poll women https tco ucevh3oj1,-0.0772,-21
12/14/2019,BBC News (UK),0.709,0.291,durham north west nohope seat tories https tco j7pkzyhmdh,0.5719,-22
12/14/2019,BBC News (UK),1.0,0.0,n korea conducts crucial test state media https tco 2qrvbiqjdu,0.0,-23
12/14/2019,BBC News (UK),1.0,0.0,australia heatwave net week could see hottest day record https tco 21fttwka,0.0,-24
12/14/2019,BBC News (UK),0.821,0.179,general election 2019 pm visit north labour heartland gains https tco qgehzqlyk,0.34,-25
12/14/2019,BBC News (UK),1.0,0.0,check train time new timetables begin https tco dofopwcp0,0.0,-26
12/14/2019,BBC News (UK),0.769,0.0,quadriga lawyers users bankrupt crypto firm seek ehumation founder https tco dvlsirmd3k,-0.5574,-27
12/14/2019,BBC News (UK),1.0,0.0,new zealand volcano search resumes two remaining bodies https tco ic4ugqjscm,0.0,-28
12/14/2019,BBC News (UK),1.0,0.0,week pictures 7 13 december 2019 https tco 4m38pekg88,0.0,-29
12/14/2019,BBC News (UK),0.889,0.0,general election 2019 viral videos nhs dominate digital campaign https tco b7nlfjelio,-0.128,-30
12/14/2019,BBC News (UK),1.0,0.0,general election 2019 undecideds cast vote https tco ut6ojgwfrl,0.0,-31
12/14/2019,BBC News (UK),1.0,0.0,election results 2019 opinion poll accuracy holds https tco r5ksriirbj,0.0,-32
12/14/2019,BBC News (UK),1.0,0.0,election results 2019 five big things boris johnsons todo list https tco nt9eermbwo,0.0,-33
12/14/2019,BBC News (UK),1.0,0.0,general election 2019 labours net leader https tco gzaz13oy,0.0,-34
12/13/2019,BBC News (UK),1.0,0.0,newspaper headlines boris johnsons christmas message healing https tco 14tfsuioir,0.0,-35
12/13/2019,BBC News (UK),1.0,0.0,saturdays epress boris im dreaming reunited kingdom via hendopolis #tomorrowspaperstoday #bbcpapers https tco p2ujdst7na,0.0,-36
12/13/2019,BBC News (UK),0.804,0.0,saturdays guardian net stop breit via hendopolis #tomorrowspaperstoday #bbcpapers https tco j6q2auav5y,-0.296,-37
12/13/2019,BBC News (UK),0.678,0.322,conservatives win means money https tco bzhdrju9im,0.5859,-38
12/13/2019,BBC News (UK),0.613,0.387,saturdays telegraph tidings comfojoy via hendopolis #tomorrowspaperstoday #bbcpapers https tco 5hcgirguz,0.743,-39
12/13/2019,BBC News (UK),0.76,0.0,saturdays independent digital corbyn refuses take rap labour disaster via hendopolis https tco gvqjusmfq,-0.6249,-40
12/13/2019,BBC News (UK),1.0,0.0,saturdays mirror time stavia hendopolis #tomorrowspaperstoday #bbcpapers https tco brsmzk5jkp,0.0,-41
12/13/2019,BBC News (UK),0.59,0.118,bbcpolitics disappointing night mps defected conservatives labour fail win seats #ge2019 tap,-0.6808,-42
12/13/2019,BBC News (UK),1.0,0.0,saturdays mail via hendopolis #tomorrowspaperstoday #bbcpapers https tco a4kytgaciz,0.0,-43
12/13/2019,BBC News (UK),1.0,0.0,saturdays times let healing begin via hendopolis #tomorrowspaperstoday #bbcpapers https tco 6dhjygbhn3,0.0,-44
12/13/2019,BBC News (UK),0.649,0.182,weekend battle united kingdom begins via hendopolis #tomorrowspaperstoday #bbcpapers https tco ye9pgiubyd,0.0516,-45
12/13/2019,BBC News (UK),1.0,0.0,ft weekend stonking mandate via hendopolis #tomorrowspaperstoday #bbcpapers https tco odjotf6sbs,0.0,-46
12/13/2019,BBC News (UK),1.0,0.0,general election 2019 leighs voters fantastic seismic shift https tco 5b2ulddd2z,0.0,-47
12/13/2019,BBC News (UK),0.895,0.105,bbcpm could stay conservative party led boris johnsonim afraid assessment character simply hes someon,0.4019,-48
12/13/2019,BBC News (UK),0.851,0.0,bbcpm dont recall getting reaction doorstep policies terribleit rejection jeremy corbyn,-0.5423,-49
12/13/2019,BBC News (UK),1.0,0.0,#ge2019 labour need new direction corbyn https tco wcs8bmrfkz,0.0,-50
12/13/2019,BBC News (UK),0.43,0.0,tyler peck drugs death mother guilty supply cruelty https tco yvejw71ugr,-0.891,-51
12/13/2019,BBC News (UK),0.472,0.0,pc andrew harper death teen denies manslaughter https tco 8hbzlbk5j7,-0.7717,-52
12/13/2019,BBC News (UK),1.0,0.0,bbcengland general election 2019 wedding ring found ballot bo https tco aw7z3po322,0.0,-53
12/13/2019,BBC News (UK),0.504,0.163,love island host caroline flack charged assault beating following incident london homehttps tco akphwbfo,-0.5267,-54
12/13/2019,BBC News (UK),0.9,0.0,bbcbreaking impeachment president donald trump gets closer inquiry panel sends charges house representatives vote https,-0.2732,-55
12/13/2019,BBC News (UK),0.853,0.147,bbcbreaking speaking outside downing street #ge2019 win uk pm boris johnson urges everyone find closure let h,0.5859,-56
12/13/2019,BBC News (UK),0.726,0.274,bbcpolitics thank trust placed us meuk pm boris johnson thanks voted conservative,0.8271,-57
12/13/2019,BBC News (UK),0.891,0.109,bbcpolitics jo swinson proud first woman lead liberal democrats prepares step party leader https tco z,0.4019,-58
12/13/2019,BBC News (UK),1.0,0.0,bbcspoengland test captain joe root left squad three t20 internationals south africamore https,0.0,-59
12/13/2019,BBC News (UK),0.808,0.192,bbcbreaking conservatives win #ge2019 majority 80 final seat declared #generalelectionresults #bbcelection https,0.5859,-60
12/13/2019,BBC News (UK),1.0,0.0,bbcpolitics conservatives hold st ives final seat declare #ge2019https tco dskfmgkyl #generalelectionresults #b,0.0,-61
12/13/2019,BBC News (UK),0.909,0.0,bbcpolitics bunty buckethead count binface candidates uk general election may missed tap,-0.296,-62
12/13/2019,BBC News (UK),0.823,0.111,bbcpolitics im deeply sorryrichard burgon says labour party takes full responsibility government amp fa,0.2748,-63
12/13/2019,BBC News (UK),0.522,0.157,love island host caroline flack charged assault beating following incident north london home https tco 9qqjgir4gf,-0.5267,-64
12/13/2019,BBC News (UK),0.811,0.189,bbcpolitics reflect regroup refreshoutgoing lib dem leader jo swinson says party must continue grow liber,0.5994,-65
12/13/2019,BBC News (UK),0.878,0.122,bbcpolitics hand may quivered ballot paper put cross conservative bouk pm boris johnson,0.4939,-66
12/13/2019,BBC News (UK),1.0,0.0,#ge2019 result actual votes questions https tco m2lz5os3p,0.0,-67
12/13/2019,BBC News (UK),1.0,0.0,#ge2019 five lessons social media election https tco 4ev1grw9p,0.0,-68
12/13/2019,BBC News (UK),1.0,0.0,bbcpolitics heres uk general election night unfolded tap epand https tco ws3qlwutqd #ge2019 #bbcelection https,0.0,-69
12/13/2019,BBC News (UK),1.0,0.0,jeremy corbyn everything could lead labour https tco hnpdehcgv,0.0,-70
12/13/2019,BBC News (UK),0.848,0.0,election taken ultimately breitlabour leader jeremy corbyn says obviously sad https tco jgwmjze6fk,-0.5256,-71
12/13/2019,BBC News (UK),0.845,0.0,olivia wilde actress say clint eastwood film richard jewell https tco cqvfhvave,-0.296,-72
12/13/2019,BBC News (UK),1.0,0.0,bbcnews snp leader nicola sturgeon says net week scottish government publish detailed democratic case second,0.0,-73
12/13/2019,BBC News (UK),1.0,0.0,snp leader nicola sturgeon says net week scottish government publish detailed democratic case https tco klav2aydvh,0.0,-74
12/13/2019,BBC News (UK),0.829,0.171,snp leader nicola sturgeon says partys electoral success incredible endorsement adding kind f https tco ngtlwvyzly,0.5719,-75
12/13/2019,BBC News (UK),1.0,0.0,bbcspojurgen klopp signed new liverpool deal details https tco bhchv4uwmm #lfc #liverpoolfc #bbcfootball #pl https,0.0,-76
12/13/2019,BBC News (UK),1.0,0.0,bbcpolitics epm david cameron congratulates boris johnson conservatives election victory adding result gives us,0.0,-77
12/13/2019,BBC News (UK),1.0,0.0,whats behind conservative victory https tco u8wacvu8fb #ge2019 #bbcelection,0.0,-78
12/13/2019,BBC News (UK),0.809,0.191,bbcworld europes press relieved wary #ge2019 result https tco iqdth0cnot,0.3818,-79
12/13/2019,BBC News (UK),1.0,0.0,bbcbreaking uk pm boris johnson travels buckingham palace ask queen form new government following conservatives v,0.0,-80
12/13/2019,BBC News (UK),1.0,0.0,bbcworld penis fish wash beach california https tco spttitqgn3,0.0,-81
12/13/2019,BBC News (UK),1.0,0.0,bbcsposteven gerrard signed new contract rangers details https tco imi7iywbmn #bbcfootball #rangersfc https tc,0.0,-82
12/13/2019,BBC News (UK),0.916,0.0,bbcpolitics lost two half million voters two years momentums national coordinator laura pa,-0.3182,-83
12/13/2019,BBC News (UK),0.823,0.0,hospital performance england drops new record worst waits aamp e hospital operations nhs f https tco ojme1hha0p,-0.6249,-84
12/13/2019,BBC News (UK),0.815,0.185,bbcworld eu carbon neutrality leaders agree 2050 target without poland https tco huzg112p7,0.3612,-85
12/13/2019,BBC News (UK),0.847,0.153,bbcpolitics conservatives win biggest majority since 1980s take look election results map britain find whats,0.5859,-86
12/13/2019,BBC News (UK),0.803,0.197,bbcpolitics labour party chairman ian lavery says fact went second referendum real issue labour party,0.6597,-87
12/13/2019,BBC News (UK),0.76,0.24,bbcpolitics conservatives win majority least 76 labours jeremy corbyn wont fight another election leader lib dem lead,0.717,-88
12/13/2019,BBC News (UK),0.901,0.0,lord buckethead wedding ring ballot bo #ge2019 moments might missedhttps tco maeripjsgw,-0.296,-89
12/13/2019,BBC News (UK),1.0,0.0,bbcpolitics questions #ge2019 resultweve got covered get touch https tco qwm7zjoou #bbcyourquestions #bbc,0.0,-90
12/13/2019,BBC News (UK),1.0,0.0,bbcelection result national result #bbcelection #ge2019 full results https tco tfomagcfsq https tco 1gb8h8gmvd,0.0,-91
12/13/2019,BBC News (UK),0.852,0.148,boris johnson says hell work night day repay trust voters leading conservatives historic el https tco zutrhqw8u,0.5106,-92
12/13/2019,BBC News (UK),0.881,0.0,bbcpolitics confused whats happened overnight #electioncasts adamfleming done allnighter bring #ge2019,-0.3182,-93
12/13/2019,BBC News (UK),0.649,0.351,lets get breit done first friends lets get breakfast doneprime minister boris johnson celebrates hi https tco omsn1gz8rd,0.8807,-94
12/13/2019,BBC News (UK),0.769,0.0,bbcbreaking election put end miserable threats second referendumuk pm boris johnson delivers,-0.7184,-95
12/13/2019,BBC News (UK),1.0,0.0,mandate majority last able asks boris johnsonget breit done c https tco 9c9mngtr3c,0.0,-96
12/13/2019,BBC News (UK),0.708,0.154,bbcpolitics today celebrate victory victory british people michael gove says voters rejected jeremy corbyns poli,0.1027,-97
